{
  "$schema": "https://json-schema.org/draft/2020-12/schema",
  "$id": "https://github.com/jgdynamite10/blackwell-agentic-inference-lab/schemas/task-observation.schema.json",
  "title": "Task Observation File",
  "description": "Raw, auditable per-task observations for one repetition of one run — one file per (run, phase). These are PRIVATE external artifacts: they are persisted only under LAB_RESULTS_DIR (never inside the Git working tree), written atomically with private file permissions, and referenced from the benchmark result by safe relative filename plus SHA-256. Warm-up observations are labeled with phase='warmup', retained separately, and excluded from every measured summary. Summary metrics are DERIVED from these observations.",
  "type": "object",
  "additionalProperties": false,
  "required": ["schema_version", "run_id", "repetition_index", "phase", "observations"],
  "properties": {
    "schema_version": {
      "type": "string",
      "pattern": "^\\d+\\.\\d+\\.\\d+$"
    },
    "run_id": {
      "type": "string",
      "minLength": 8,
      "description": "Must match the run_id of the manifest and result of this repetition."
    },
    "repetition_index": { "type": "integer", "minimum": 1 },
    "phase": {
      "type": "string",
      "enum": ["measured", "warmup"],
      "description": "Warm-up files are retained for audit but never enter measured summaries."
    },
    "observations": {
      "type": "array",
      "items": { "$ref": "#/$defs/observation" }
    }
  },
  "$defs": {
    "observation": {
      "type": "object",
      "additionalProperties": false,
      "required": [
        "task_index",
        "template_id",
        "instance_id",
        "instance_seed",
        "status",
        "error_category",
        "submitted_at_utc",
        "submitted_offset_ms",
        "started_offset_ms",
        "ended_offset_ms",
        "e2e_ms",
        "queue_wait_ms",
        "turns",
        "tool_trace",
        "terminal",
        "evaluation"
      ],
      "properties": {
        "tool_call_diagnostics": {
          "type": "object",
          "additionalProperties": false,
          "description": "Sanitized structural diagnostics for a rejected native tool call. Never contains prompts, completions, reasoning, credentials, or private paths.",
          "required": [
            "failure_category",
            "event_types",
            "tool_call_count",
            "content_chars"
          ],
          "properties": {
            "failure_category": { "type": "string" },
            "event_types": {
              "type": "array",
              "items": { "type": "string" }
            },
            "tool_call_count": { "type": "integer", "minimum": 0 },
            "function_name_valid": { "type": ["boolean", "null"] },
            "arguments_json_ok": { "type": ["boolean", "null"] },
            "arguments_schema_ok": { "type": ["boolean", "null"] },
            "content_chars": { "type": "integer", "minimum": 0 },
            "usage_completion_tokens": { "type": ["integer", "null"] }
          }
        },
        "evidence_grounding": {
          "type": "object",
          "additionalProperties": false,
          "description": "Sanitized evidence-grounding controller accounting (workload 2.5.0, controller evidence-grounding-v1). Counts only: never observation IDs, payloads, prompts, completions, reasoning, or scenario data. Absent for controller-free workloads.",
          "required": [
            "controller",
            "observations",
            "eligible_observations",
            "terminal_attempts",
            "rejected_terminal_attempts",
            "accepted_evidence_refs"
          ],
          "properties": {
            "controller": { "type": "string", "enum": ["evidence-grounding-v1"] },
            "observations": { "type": "integer", "minimum": 0 },
            "eligible_observations": { "type": "integer", "minimum": 0 },
            "terminal_attempts": { "type": "integer", "minimum": 0 },
            "rejected_terminal_attempts": { "type": "integer", "minimum": 0 },
            "accepted_evidence_refs": { "type": ["integer", "null"], "minimum": 1 }
          }
        },
        "workflow_control": {
          "type": "object",
          "additionalProperties": false,
          "description": "Sanitized workflow-controller accounting (workloads 2.6.0 / 2.6.1, controller workflow-controller-v1, decision D-0031). Counts and generic state names only: never observation IDs, payloads, prompts, completions, reasoning, queries, or scenario data. Absent for every other workload.",
          "required": [
            "controller",
            "treatments",
            "final_state",
            "transitions",
            "observations",
            "eligible_observations",
            "usable_log_observations",
            "zero_match_searches",
            "not_found_lookups",
            "runbooks_found",
            "terminal_attempts",
            "rejected_terminal_attempts",
            "rejection_categories",
            "accepted_evidence_refs",
            "remaining_turn_warnings"
          ],
          "properties": {
            "controller": { "type": "string", "enum": ["workflow-controller-v1"] },
            "treatments": {
              "type": "array",
              "items": { "type": "string", "enum": ["evidence-refs"] },
              "uniqueItems": true
            },
            "final_state": {
              "type": "string",
              "enum": [
                "investigating",
                "runbook_retrieved",
                "evidence_collected",
                "ready_for_terminal",
                "terminal_accepted",
                "budget_exhausted"
              ]
            },
            "transitions": {
              "type": "array",
              "items": {
                "type": "object",
                "additionalProperties": false,
                "required": ["from", "to"],
                "properties": {
                  "from": { "type": "string" },
                  "to": { "type": "string" }
                }
              }
            },
            "observations": { "type": "integer", "minimum": 0 },
            "eligible_observations": { "type": "integer", "minimum": 0 },
            "usable_log_observations": { "type": "integer", "minimum": 0 },
            "zero_match_searches": { "type": "integer", "minimum": 0 },
            "not_found_lookups": { "type": "integer", "minimum": 0 },
            "runbooks_found": { "type": "integer", "minimum": 0 },
            "terminal_attempts": { "type": "integer", "minimum": 0 },
            "rejected_terminal_attempts": { "type": "integer", "minimum": 0 },
            "rejection_categories": {
              "type": "object",
              "additionalProperties": { "type": "integer", "minimum": 1 }
            },
            "accepted_evidence_refs": { "type": ["integer", "null"], "minimum": 1 },
            "remaining_turn_warnings": { "type": "integer", "minimum": 0 }
          }
        },
        "task_index": { "type": "integer", "minimum": 0, "description": "0-based submission order within the repetition." },
        "template_id": { "type": "string", "minLength": 1, "description": "Incident template (scenario) id." },
        "instance_id": { "type": "string", "minLength": 1, "description": "Seeded task-instance id (template_id#occurrence)." },
        "instance_seed": { "type": "integer", "description": "Deterministic per-instance seed derived from the run seed." },
        "status": { "type": "string", "enum": ["completed", "error", "timeout"] },
        "error_category": {
          "type": ["string", "null"],
          "description": "Sanitized execution-error category from the documented taxonomy (including direct_evidence_required for workload 2.5.0 and workflow_requirements_unmet for workloads 2.6.0 / 2.6.1); null for completed tasks. Never contains raw exception text."
        },
        "submitted_at_utc": { "type": "string", "format": "date-time" },
        "submitted_offset_ms": { "type": "number", "minimum": 0, "description": "Driver submission instant, monotonic offset from repetition start." },
        "started_offset_ms": { "type": "number", "minimum": 0, "description": "Worker dequeue/start instant, monotonic offset from repetition start." },
        "ended_offset_ms": { "type": "number", "minimum": 0, "description": "Terminal stamp (hand-off to evaluator), monotonic offset from repetition start." },
        "e2e_ms": { "type": "number", "minimum": 0, "description": "ended - submitted: includes driver queue wait, model turns, and consumed simulated tool delays." },
        "queue_wait_ms": { "type": "number", "minimum": 0, "description": "started - submitted (driver-side slot wait)." },
        "turns": {
          "type": "array",
          "items": { "$ref": "#/$defs/turn" }
        },
        "tool_trace": {
          "type": "array",
          "items": { "$ref": "#/$defs/tool_trace_entry" }
        },
        "terminal": {
          "type": ["object", "null"],
          "additionalProperties": false,
          "required": ["diagnosis_id", "rationale", "remediation_id"],
          "description": "The agent's terminal recommendation; null when the task did not complete.",
          "properties": {
            "diagnosis_id": { "type": "string" },
            "rationale": { "type": "string" },
            "remediation_id": { "type": "string" }
          }
        },
        "evaluation": {
          "type": "object",
          "additionalProperties": false,
          "required": ["evaluator_version", "success", "score", "gates", "diagnosis_component", "remediation_component", "evidence_component"],
          "properties": {
            "evaluator_version": { "type": "string" },
            "success": { "type": "boolean" },
            "score": { "type": "number", "enum": [0.0, 1.0], "description": "Binary: 1.0 iff every mandatory gate passed (S_min = 1.0)." },
            "gates": {
              "type": "array",
              "items": {
                "type": "object",
                "additionalProperties": false,
                "required": ["gate_id", "passed"],
                "properties": {
                  "gate_id": { "type": "string" },
                  "passed": { "type": "boolean" },
                  "detail": { "type": "string" }
                }
              }
            },
            "diagnosis_component": { "type": "number", "minimum": 0, "maximum": 1, "description": "Diagnostic only; never defines success." },
            "remediation_component": { "type": "number", "minimum": 0, "maximum": 1, "description": "Diagnostic only; never defines success." },
            "evidence_component": { "type": "number", "minimum": 0, "maximum": 1, "description": "Diagnostic only; never defines success." },
            "reason": { "type": "string" }
          }
        }
      }
    },
    "turn": {
      "type": "object",
      "additionalProperties": false,
      "required": ["ttft_ms", "serving_time_ms", "chunk_count", "content_chars", "itl_available", "output_tokens"],
      "description": "Driver-side record of one model turn. Transport chunks are never tokens: output_tokens comes only from authoritative usage data and inter-token gaps only from true token events; otherwise both are null/unavailable with reasons.",
      "properties": {
        "ttft_ms": { "type": ["number", "null"], "minimum": 0, "description": "Time to the first meaningful model-output event (content, reasoning output, or native tool-call delta); null when the turn produced none." },
        "serving_time_ms": { "type": "number", "minimum": 0 },
        "chunk_count": { "type": "integer", "minimum": 0, "description": "Privacy-safe output-event count: content chunks, reasoning-output events, and the first native tool-call delta. Not a token count and not the later assembled native_tool_call." },
        "content_chars": { "type": "integer", "minimum": 0 },
        "itl_available": { "type": "boolean" },
        "itl_unavailable_reason": { "type": ["string", "null"] },
        "inter_token_gaps_ms": {
          "type": "array",
          "items": { "type": "number", "minimum": 0 },
          "description": "Present (non-empty) only when true per-token timing exists."
        },
        "output_tokens": { "type": ["integer", "null"], "minimum": 0, "description": "Authoritative usage-based count; null when unavailable." },
        "tokens_unavailable_reason": { "type": ["string", "null"] },
        "engine_queue_time_ms": { "type": ["number", "null"], "minimum": 0, "description": "Serving-engine-reported queue time; null when the engine reports none." }
      }
    },
    "tool_trace_entry": {
      "type": "object",
      "additionalProperties": false,
      "required": ["tool", "arguments", "result", "simulated_latency_ms"],
      "properties": {
        "tool": { "type": "string", "minLength": 1 },
        "arguments": { "type": "object", "description": "The validated arguments as executed." },
        "result": { "type": "object", "description": "The tool's returned payload (synthetic fixture data only)." },
        "simulated_latency_ms": { "type": "number", "minimum": 0 }
      }
    }
  }
}
